review	sectionId	type_page	type_model	type_review	used
В принципе, она оправдала мои ожидания. У меня были определенные требования к репетитору по английскому языку и в целом я остался доволен ее работой с учетом моих пожеланий относительно обучения ребенка (3 класс). Педагог хорошо преподает английский язык детям младшего школьного возраста - это было для нас большим плюсом при выборе специалиста!	Репетиторы по английскому языку		порог 0.8, ранд seed ранд тем от 0.1 до 0.1592	AI	0.0
В принципе, с преподавателем у меня сложились нормальные отношения. Я занималась недолго и не могу сказать о каких-то глобальных результатах в изучении английского языка или же его преподавании - я просто получила знания по грамматике для себя на тот момент времени (до этого училась за границей). Но темами мы занимались достаточно плотно именно потому что мне нужно было подготовиться к собеседованию при поиске работы заграницей либо перед поездкой туда самостоятельно; также педагог давал много информации касательно того как правильно вести диалог со специалистом во время интервьюирования.	Репетиторы по английскому языку		порог 0.8, ранд seed ранд тем от 0.1 до 0.3953	AI	0.0
В принципе, я доволен работой репетитора. У меня были определенные пожелания по поводу того как лучше проводить занятия с ребенком (3 класс). С педагогом мы занимались в течение месяца и за это время ребенок получил достаточно знаний для себя лично - он стал понимать английский язык на слух! Педагог очень хорошо преподает грамматику ребенку!!	Репетиторы по английскому языку		порог 0.8, ранд seed ранд тем от 0.1 до 0.2839	AI	0.0
В работе репетитора меня всё устраивает. Уроки проходят интересно, в доброжелательной обстановке и с использованием различных методик обучения английскому языку (грамматика + аудирование). Я очень довольна работой преподавателя!	Репетиторы по английскому языку		порог 0.8, ранд seed ранд тем от 0.1 до 0.1672	AI	0.0
В целом мне нравится заниматься с репетитором. Она хорошо преподает английский язык, но я бы хотела больше практики и разговорной речи от педагога в плане того как правильно строить предложения на английском языке для работы или учебы за границей (я работаю заграницей).	Репетиторы по английскому языку		порог 0.8, ранд seed ранд тем от 0.1 до 0.3355	AI	0.0
В этом году, мы уже не занимаемся с репетитором. Но в следующем учебном годе я планирую возобновить занятия именно с данным педагогом! Она очень хорошо преподает английский язык и доступно объясняет материал ученику 4 класса. Я осталась довольна ее работой на все 100 %.	Репетиторы по английскому языку		порог 0.8, ранд seed ранд тем от 0.1 до 0.751	AI	0.0
Великолепный репетитор! Она очень хорошо и доступно объясняет материал, использует в работе различные аудио-, видеоматериалы. Уроки проходят интересно для ребенка 4 класса с углубленным изучением английского языка (в данном случае разговорного). Мы довольны сотрудничеством на все 100%.	Репетиторы по английскому языку		порог 0.8, ранд seed ранд тем от 0.1 до 0.392	AI	0.0
Впечатления очень хорошие. У меня ребенок в восторге от репетитора, он ждет занятий с ней и не хочет заниматься по школьной программе! Педагог дает много дополнительного материала для изучения английского языка - это помогает ребенку лучше усваивать материал на уроках школы (у нас была цель повысить успеваемость).	Репетиторы по английскому языку		порог 0.8, ранд seed ранд тем от 0.1 до 0.709	AI	0.0
Впечатления самые наилучшие. Я очень довольна репетитором! У меня было много преподавателей, но такого уровня я еще не встречала ни у кого из них и даже близко к нему нет (я имею в виду уровень знаний). Педагог дает мне хорошие знания по английскому языку для подготовки ко всем тестам IELTS - это самый главный показатель его профессионализма. Он использует на занятиях аудио-, видеоматериалы, различные учебные пособия  с учетом моих пожеланий!	Репетиторы по английскому языку		порог 0.8, ранд seed ранд тем от 0.1 до 0.961	AI	0.0
Грамотный и компетентн. преподаватель английского языка, очень хорошо знает свой предмет! Она умеет найти подход к ученику  с первых минут занятий (мы занимаемся всего месяц), материал объясняет в простой понятной форме без зубрежки или заучивания правил из учебников; занятия проходят интересно для ребенка 4 класса по школьной программе 2 раза/неделя на английском языке. Мы довольны сотрудничеством!	Репетиторы по английскому языку		порог 0.8, ранд seed ранд тем от 0.1 до 0.363	AI	0.0
Грамотный и компетентнно обученный специалист, отлично владеющий своим предметом. Репетитор помогает мне освоить английский язык с нуля для работы в международной компании. Я очень довольна сотрудничеством!	Репетиторы по английскому языку		порог 0.8, ранд seed ранд тем от 0.1 до 0.3497	AI	0.0
Грамотный и компетентны специалист, с которым легко найти общий язык. Репетитор помогает мне повысить уровень владения английского языка по программе. Занятия проходят регулярно в удобное для меня время на территории преподавателя (в офисе). Я очень довольна сотрудничеством!	Репетиторы по английскому языку		порог 0.8, ранд seed ранд тем от 0.1 до 0.3973	AI	0.0
"Грамотный педагог. Она хорошо знает свой предмет и грамотно его преподает, умеет заинтересовать занятиями ученика с помощью интересных методик преподавания материала в игровой форме (игрушки). У сына повысилась успеваемость по английскому языку до ""пятёрки"". Мы очень довольны сотрудничеством!"	Репетиторы по английскому языку		порог 0.8, ранд seed ранд тем от 0.1 до 0.1045	AI	0.0
Грамотный преподаватель, хорошо владеющий своим предметом. Она умеет найти подход к ученику и заинтересовать занятиями! Педагог помогает мне повысить уровень владения английским языком с упором на бизнес-направление английского языка (бизнес английский). Занятия проходят динамично в интересной форме благодаря разнообразным дополнительным материалам преподавателя : распечаткам текстов, видеофильмам. В целом я довольна сотрудничеством со специалистом!	Репетиторы по английскому языку		порог 0.8, ранд seed ранд тем от 0.1 до 0.2606	AI	0.0
"Грамотный, компетентнейший педагог. Она быстро нашла общий язык с ребенком и грамотно организовала учебный процесс по английскому языку в соответствии со школьной программой 5-го класса школы №9 города Новосибирска (было всего 3 занятия). Результаты занятий положительные! Ребенок стал лучше понимать английский на слух; оценки у него улучшились до ""4"" баллов из пяти возможных за четверть при том условии что ранее были отметки 2 балла или даже ниже. Мы очень довольны работой!"	Репетиторы по английскому языку		порог 0.8, ранд seed ранд тем от 0.1 до 0.3731	AI	0.0
Грамотный, компетентный в своей области педагог! Она быстро нашла общий язык с ученицей и грамотно организовала учебный процесс. Материал давался интересно репетитором по английскому языку, легко усваивался благодаря системному подходу к подаче материала, у нее есть четкая методика преподавания предмета, которая отлично подошла ребенку, она очень хорошо подтянула дочь, даже оценки улучшились. Мы остались довольны сотрудничеством!	Репетиторы по английскому языку		порог 0.8, ранд seed ранд тем от 0.1 до 0.3107	AI	0.0
Данная девушка - отличный репетитор. Она очень хорошо преподает английский язык, и я могу сказать о ней все только самое хорошее! У нее есть индивидуальный подход к каждому ученику (я имею в виду не просто набор слов), она умеет заинтересовать предметом даже тогда когда ученик ленится или занят. Также хочу отметить ее пунктуальность во время занятий с моим ребенком-подростком 14 лет.	Репетиторы по английскому языку		порог 0.8, ранд seed ранд тем от 0.1 до 0.3682	AI	0.0
Отличный специалист для подготовки к TOEFL. Она очень хорошо и доступно объясняет материал, всегда подготовлена ко всем урокам! Уроки проходят в комфортной атмосфере с использованием различных материалов на уроках английского языка (видео-, аудиоматериалы), а также дополнительных учебных пособий по предмету. Я уже чувствую прогресс - мой уровень знаний значительно повысился благодаря педагогу за время нашего сотрудничества!!!	Репетиторы по английскому языку		порог 0.8, ранд seed ранд тем от 0.1 до 0.3038	AI	0.0
Специалист преподавала мне английский язык. Она очень хороший преподаватель, грамотный и компетентный в своей области специалист! Репетитор умеет найти подход к ученику с первого занятия при помощи различных методик обучения английскому языку (грамматика - разговорная практика), доступно излагает материал по предмету благодаря четкой системе преподавания материала на занятиях у репетитора всегда была комфортная атмосфера для занятий. За время нашего сотрудничества я значительно улучшила свои знания английского языка, мой словарный запас увеличился за счет использования новых слов из активного запаса лексики во времена общения со мной педагога- носителя данного иностранного языка!	Репетиторы по английскому языку		порог 0.8, ранд seed ранд тем от 0.1 до 0.1484	AI	0.0
Преподаватель произвела на меня положительные впечатления. Она очень хорошо знает свой предмет и грамотно, доступно его преподает! Репетитор помогает мне повысить уровень владения английским языком с упором именно в бизнес-направление - разговорную речь для работы за границей (в частности по работе со страховыми компаниями). Я уже значительно лучше стала понимать английскую грамматику благодаря занятиям  репетитора.	Репетиторы по английскому языку		порог 0.8, ранд seed ранд тем от 0.1 до 0.2555	AI	0.0
Данный специалист, как педагог нас полностью устроила! Репетитор умеет найти подход к ученику и грамотно построить урок. Педагог помогает нам повысить уровень владения английским языком с Pre-Intermediate до Intermidiary (было - стало). Занятия проходят интересно в игровой форме на уроках используются различные дополнительные материалы для лучшего запоминания слов/терминов по предмету. Результаты есть!! Работать со специалистом продолжаем!	Репетиторы по английскому языку		порог 0.8, ранд seed ранд тем от 0.1 до 0.1275	AI	0.0
Учительница очень понравилась моему сыну, он ждал ее уроков с удовольствием. Репетитор хорошо преподавала английский язык и смогла заинтересовать ребенка предметом! Они занимались по школьной программе за 4 класс до каникул сына в конце учебного года (в этом году мы закончили заниматься раньше).	Репетиторы по английскому языку		порог 0.8, ранд seed ранд тем от 0.1 до 0.145	AI	0.0
Очень хороший репетитор, с ней приятно общаться. Она хорошо преподает английский язык и занятия проходят интересно! Педагог помогает мне повысить уровень владения английским языком до разговорного уровня (в настоящее время я уже могу изъясняться несложными фразами). Мы занимаемся по учебнику Оксфордского университета в формате онлайн-занятий для подготовки к IELTS. Я довольна сотрудничеством со специалистом - она дает хорошие знания ученику начальной школы!	Репетиторы по английскому языку		порог 0.8, ранд seed ранд тем от 0.1 до 0.818	AI	0.0
Учитель помогает сыну подготовиться ко ВНО онлайн. Репетитор хорошо владеет английским языком, умеет заинтересовать ученика занятиями и доступно преподносит материал по предмету в простой понятной форме! Они занимаются не только подготовкой к экзамену - репетитором также изучаются грамматика языка с упором на разговорную речь  для более свободного общения между собой во время путешествий за границей или при поездках туда-обратно (в зависимости от того куда именно мы едем). Мы очень довольны работой преподавателя английского!	Репетиторы по английскому языку		порог 0.8, ранд seed ранд тем от 0.1 до 0.3789	AI	0.0
Специалист мне очень понравилась, как преподаватель! Она хорошо знает свой предмет и грамотно его преподает. Педагог смог быстро найти подход к ребенку (ученик учится во 2 классе), сумел заинтересовать предметом - занятия проходили интересно для ребенка с использованием различных дополнительных материалов на компьютере или ноутбуке в игровой форме; сын занимался охотно  до тех пор пока репетитор не прервал уроки по личным причинам.	Репетиторы по английскому языку		порог 0.8, ранд seed ранд тем от 0.1 до 0.1950	AI	0.0
Педагог хорошо знает английский язык, умеет донести знания до ученика. Она использует в работе различные методики и учебники для изучения языка (учебники издательства Oxford English), всегда прислушивается к моему мнению при составлении плана занятий по предмету!	Репетиторы по английскому языку		порог 0.8, ранд seed ранд тем от 0.1 до 0.2124	AI	0.0
Преподаватель очень нравится сыну, он с удовольствием ходит к ней на занятия. Репетитор помогает ему подтянуть успеваемость по английскому языку и дает много знаний ребенку за короткий срок обучения!	Репетиторы по английскому языку		порог 0.8, ранд seed ранд тем от 0.1 до 0.1798	AI	0.0
"Педагог очень хорошо и профессионально подошла к нашему непростому делу. Она сразу же нашла подход, сумела заинтересовать ребенка занятиями по английскому языку с репетитором! Педагог помогает моему сыну подтянуть успеваемость в школе  до ""4"" баллов на уроках английского языка при помощи дополнительных материалов (картинок), дает много заданий для самостоятельной работы ученика над лексикой предмета - все это способствует быстрому усвоению материала ребенком-третьеклассником. Мы довольны сотрудничеством со специалистом!"	Репетиторы по английскому языку		порог 0.8, ранд seed ранд тем от 0.1 до 0.916	AI	0.0
Педагог произвела на меня самое хорошее впечатление. Она очень хорошо знает свой предмет, умеет донести свои знания до ученика в простой и понятной форме без зубрежки материала! Репетитор помогает мне освоить английский язык с нуля для работы (я переводчик), использует различные источники информации при обучении - аудио-, видеоматериалы , учебные пособия. Занятия всегда проходят вовремя! Я уже значительно лучше стала знать грамматику английского языка благодаря занятиям со специалистом!!!	Репетиторы по английскому языку		порог 0.8, ранд seed ранд тем от 0.1 до 0.1356	AI	0.0
Учительница нам очень нравится. Она хорошо ладит с ребенком, занятия проходят интересно и продуктивно! Педагог помогает моему сыну подтянуть успеваемость по английскому языку в школе за 4 класс  до более высокого уровня знаний предмета - это уже видно на школьных оценках ребенка после занятий репетитора со специалистом (в данном случае оценка 5). Мы довольны сотрудничеством полностью!!!	Репетиторы по английскому языку		порог 0.8, ранд seed ранд тем от 0.1 до 0.72	AI	0.0
