review	sectionId	type_page	type_model	type_review	used
Замечательный преподаватель английского языка с индивидуальным подходом к ученику. Уроки всегда интересные, насыщенные информацией в хорошем темпе (с использованием аудио-материалов). Я бы порекомендовала данного преподавателя всем желающим освоить разговорный  уровень владения английским языком! Очень рекомендую этого специалиста своим знакомым!!! Рекомендую обращаться если необходимо быстро повысить свой словарный запас или же просто хочется освежить свои знания по предмету!!! Спасибо за подбор отличного педагога!!))))) Всем советую!	Репетиторы по английскому языку		порог 0.8, ранд seed ранд тем от 0.1 до 0.2709	AI	0.0
Замечательный преподаватель английского языка. Она очень быстро нашла общий язык с ребенком, сумела заинтересовать его предметом и преподает в доступной форме! Дочь занимается охотно  изучением предмета на данном этапе обучения (в школе у нас только пятерки по предмету), а также получает знания из дополнительных источников информации для общего развития ребенка.	Репетиторы по английскому языку		порог 0.8, ранд seed ранд тем от 0.1 до 0.1060	AI	0.0
Замечательный преподаватель английского языка. Она очень хорошо и доступно объясняет материал, всегда готовится к занятиям  с использованием различных методических пособий (бумажных материалов), использует аудио- видеозаписи на занятиях в хорошем качестве! Мне нравится то, что она не только дает мне знания по грамматике или разговорную практику для общения за границей но также уделяет внимание развитию навыков аудирования. Я уже значительно лучше стала понимать английскую речь!	Репетиторы по английскому языку		порог 0.8, ранд seed ранд тем от 0.1 до 0.3584	AI	0.0
"Замечательный преподаватель, грамотный и компетентный в своей области специалист. Она быстро нашла подход к ребенку (ученик 9 класса), сумела заинтересовать его занятиями по английскому языку на высоком уровне! Педагог помогает моему сыну повысить успеваемость  до ""5"", использует разнообразные методические пособия для обучения ребенка - все это способствует повышению уровня знаний ученика английского языка у данного специалиста уже сейчас!!!"	Репетиторы по английскому языку		порог 0.8, ранд seed ранд тем от 0.1 до 0.1131	AI	0.0
Замечательный преподаватель, она просто шикарный педагог! У меня было много репетиторов и все они были не очень хорошего уровня. Но с данным педагогом я занималась всего месяц-полтора (поскольку у нас был небольшой перерыв), но за это время мои знания английского языка значительно улучшились благодаря ее работе над ошибками в грамматике речи. Я считаю что ей удалось добиться поставленной цели, так как мой уровень знаний повысился на несколько баллов!	Репетиторы по английскому языку		порог 0.8, ранд seed ранд тем от 0.1 до 0.3949	AI	0.0
Замечательный преподаватель, очень хороший человек и просто отличный специалист! Она быстро нашла подход к ребенку (ученик 4 класса), материал объясняла в простой понятной форме. Педагог смогла заинтересовать ребенка предметом на достаточно высоком уровне благодаря своей методике преподавания английского языка. Уроки всегда проходили вовремя с учетом наших договоренностей, все договоренности строго соблюдались репетитором! Благодаря данному учителю ребенок хорошо подтянулся по предмету!!	Репетиторы по английскому языку		порог 0.8, ранд seed ранд тем от 0.1 до 0.1025	AI	0.0
Замечательный преподаватель! Она очень хорошо и доступно объясняет материал, всегда готова ответить на вопросы. С ней легко заниматься английским языком в любое время суток (аудирование мы не берем во внимание). Репетитор помогает мне повысить уровень владения английского языка с помощью аудио-, видеозаписей уроков репетитора(их у меня уже более 200), а также дает различные дополнительные материалы для изучения предмета. Я всем довольна!	Репетиторы по английскому языку		порог 0.8, ранд seed ранд тем от 0.1 до 0.523	AI	0.0
Замечательный преподаватель! Она очень хорошо и доступно объясняет материал, всегда готовится к занятиям. Педагог помогает мне освоить английский язык с нуля (я учусь в 10 классе), мы работаем над грамотностью речи по учебнику, произношением слов на английском языке. Занятия проходят интересно для меня! Я довольна результатами сотрудничества со специалистом : мой уровень знаний английского языка стал намного выше благодаря репетитору!!!	Репетиторы по английскому языку		порог 0.8, ранд seed ранд тем от 0.1 до 0.449	AI	0.0
Замечательный репетитор английского для детей 4-6 лет (в зависимости от возраста ребёнка). Она очень хорошо и доступно объясняет материал, всегда готова ответить на вопросы ученика. Уроки проходят интересно в игровой форме с использованием различных материалов по предмету из разных источников информации : аудио-, видеоматериалы, книги. Мы занимаемся всего месяц но уже видим хороший результат!	Репетиторы по английскому языку		порог 0.8, ранд seed ранд тем от 0.1 до 0.1446	AI	0.0
Замечательный репетитор, она очень хорошо нашла подход к ребенку. У нас были некоторые проблемы с английским языком и педагог помогла нам их решить! Репетитора мы рекомендуем другим клиентам сайта.	Репетиторы по английскому языку		порог 0.8, ранд seed ранд тем от 0.1 до 0.3393	AI	0.0
Замечательный репетитор, она прекрасно владеет английским языком и очень профессионально им пользуется. Уроки проходят в интересной форме с использованием различных материалов на занятиях по подготовке к ЕГЭ (в том числе аудио-). Мне все нравится!	Репетиторы по английскому языку		порог 0.8, ранд seed ранд тем от 0.1 до 0.3176	AI	0.0
Замечательный репетитор! Она очень хорошо и доступно объясняет материал, всегда готовится к занятиям. Педагог помогает мне повысить уровень владения английским языком с помощью разговорной практики на занятиях в группах из четырех-пяти человек (для меня это достаточно сложный объем). Я занимаюсь уже месяц по два раза неделю для подготовки ко IELTS. Мне нравится то качество преподавания педагога, которое выражается не только во внимании преподавателя ученику или его профессионализме но также еще одним немаловажным фактором является индивидуальный подход специалиста который учитывает мои пожелания при составлении программы обучения исходя их моих знаний английского языка!	Репетиторы по английскому языку		порог 0.8, ранд seed ранд тем от 0.1 до 0.2027	AI	0.0
Замечательный специалист! Занимаемся с ней до сих пор, очень довольны сотрудничеством. Уроки проходят интересно и продуктивно для ребенка 4 класса по английскому языку в игровой форме, ребенок занимается охотно - это главное условие успеха нашего сотрудничества с педагогом.	Репетиторы по английскому языку		порог 0.8, ранд seed ранд тем от 0.1 до 0.1737	AI	0.0
Занималась я не долго, но впечатления от занятий положительные. Педагог мне очень понравился и как человек тоже! У меня были определенные пожелания к занятиям по английскому языку с репетитором - это разговорная практика для свободного общения на английском языке (в том числе бизнес-переговорный английский). Мне понравилось то что педагог прислушивалась ко всем моим пожеланиям в плане того чтобы мы больше говорили именно о бизнесе или каких либо темах связанных со сферой бизнеса. Я считаю,что за такой короткий срок можно добиться хороших результатов!	Репетиторы по английскому языку		порог 0.8, ранд seed ранд тем от 0.1 до 0.2168	AI	0.0
Занятия по английскому языку с Надеждой Анатольевной проходят насыщенно и интересно. Педагог использует в работе различные методики, учебники на разные темы для лучшего усвоения материала ученицей (в том числе разговорного уровня). Мы очень довольны сотрудничеством!	Репетиторы по английскому языку		порог 0.8, ранд seed ранд тем от 0.1 до 0.1245	AI	0.0
Занятия по английскому языку у моего сына проходят хорошо, он получает только положительные оценки. Педагог помогает ему повысить уровень знаний и знания грамматики языка в целом! Мы довольны сотрудничеством с педагогом на все 100%.	Репетиторы по английскому языку		порог 0.8, ранд seed ранд тем от 0.1 до 0.1783	AI	0.0
Занятия продолжаются, все отлично. У меня есть положительные результаты от занятий с репетитором по английскому языку - это и разговорная речь улучшилась (я стала лучше понимать носителей языка), также грамматика подтянулась! Я очень довольна работой преподавателя!	Репетиторы по английскому языку		порог 0.8, ранд seed ранд тем от 0.1 до 0.1654	AI	0.0
Занятия проходили хорошо, мне все понравилось. Педагог очень хороший! Она доступно объясняла материал по английскому языку и была доброжелательна ко всем ученикам в группе из четырех человек (я - первый ученик). Я считаю ее одним лучших репетиторов на свете!!!	Репетиторы по английскому языку		порог 0.8, ранд seed ранд тем от 0.1 до 0.2307	AI	0.0
"Занятия проходят замечательно. Я очень довольна! У меня есть результаты, и я уже чувствую себя намного увереннее на уроках английского языка в университете (на данный момент учусь по направлению ""Финансы"")."	Репетиторы по английскому языку		порог 0.8, ранд seed ранд тем от 0.1 до 0.3704	AI	0.0
Занятия проходят отлично! Я очень довольна. У меня есть результаты, и я чувствую себя намного увереннее на уроках английского языка - это заметно по моим оценкам в школе (4-5).	Репетиторы по английскому языку		порог 0.8, ранд seed ранд тем от 0.1 до 0.3824	AI	0.0
Занятия проходят очень хорошо, я всем довольна! Педагог дает мне хорошие знания по английскому языку. Она доступно объясняет материал и использует в работе различные источники информации - аудио-, видеоматериалы на занятиях присутствуют всегда (я занимаюсь с репетитором уже несколько месяцев). Я чувствую прогресс от занятий во всех направлениях английского языка : словарный запас пополняется, произношение становится более правильным.	Репетиторы по английскому языку		порог 0.8, ранд seed ранд тем от 0.1 до 0.739	AI	0.0
Занятия проходят у преподавателя. У меня ребенок не очень хорошо воспринимает информацию, но репетитор нашла к нему подход и расположила его внимание на занятиях английским языком с ней (ребенок учится в 4 классе). Я считаю это большим достижением!	Репетиторы по английскому языку		порог 0.8, ранд seed ранд тем от 0.1 до 0.2297	AI	0.0
Занятия с педагогом идут по плану. Она хорошо преподает английский язык, доступно объясняет материал и всегда готовится к урокам заранее! Я очень довольна сотрудничеством  со специалистом - она помогает мне освоить разговорный уровень английского языка, а также дает знания грамматики. Мы занимаемся не так долго (около месяца), но уже есть положительные результаты от занятий : я стала лучше понимать английскую речь на слух; мой словарный запас увеличился в разы!	Репетиторы по английскому языку		порог 0.8, ранд seed ранд тем от 0.1 до 0.691	AI	0.0
Занятия с педагогом продолжаются, очень довольны сотрудничеством. Она - профессионал своего дела! Умеет найти подход к ученику и доступно объяснить материал по английскому языку для подготовки в вузе или техникумах за короткий срок (3-4 недели). Мы продолжаем заниматься до сих пор успешно благодаря ее профессионализму!!!	Репетиторы по английскому языку		порог 0.8, ранд seed ранд тем от 0.1 до 0.3319	AI	0.0
Занятия с педагогом проходят очень хорошо. Она - профессионал своего дела, умеет найти подход к ученику и грамотно построить урок! Уроки всегда начинаются вовремя без переносов или опозданий со стороны преподавателя. Специалист прекрасно владеет английским языком!	Репетиторы по английскому языку		порог 0.8, ранд seed ранд тем от 0.1 до 0.3472	AI	0.0
Занятия с преподавателем продолжаются. Она очень хороший преподаватель, грамотный и компетентный в своей области специалист! Репетитор помогает мне освоить английский язык, доступно преподносит материал по предмету. Мы работаем над лексикой английского языка (грамматика), произношением слов на английском языке(с использованием различных источников информации). Она всегда пунктуальна!	Репетиторы по английскому языку		порог 0.8, ранд seed ранд тем от 0.1 до 0.755	AI	0.0
Занятия с учителем очень нравятся, материал объясняет доходчиво и понятно. Уроки проходят в комфортной атмосфере для обучения! Педагог помогает мне освоить английский язык на высоком уровне благодаря грамотному подходу к обучению - все доступно преподносится  по предмету. Я уже значительно лучше стала знать грамматику языка, улучшила разговорную речь! Спасибо большое за подбор отличного репетитора!!!	Репетиторы по английскому языку		порог 0.8, ранд seed ранд тем от 0.1 до 0.1409	AI	0.0
Занятия с преподавателем продолжаются, и положительные результаты уже появились. Педагог помогает мне освоить английский язык на начальном уровне для работы (я работаю в IT сфере). Репетитор использует различные методики обучения - аудио-, видеоматериалы , учебники. Уроки проходят интересно! Я очень довольна сотрудничеством!	Репетиторы по английскому языку		порог 0.8, ранд seed ранд тем от 0.1 до 0.625	AI	0.0
Занятия с педагогом продолжаются. Она очень хороший преподаватель, грамотный и компетентный в своей области специалист! Репетитор помогает мне освоить английский язык на высоком уровне владения предметом (грамматика), имеет четкую методику преподавания материала - все отлично усваивается слушателем! Ольга Александровна всегда приходит вовремя, занятия проходят интересно. Я уже значительно лучше стала знать грамматику английского языка благодаря работе преподавателя!!!	Репетиторы по английскому языку		порог 0.8, ранд seed ранд тем от 0.1 до 0.3391	AI	0.0
Занятия с педагогом были полезны для меня. Я подтянул разговорный английский язык, улучшил грамматику и обогатил лексический запас по предмету в целом! Мне понравилось заниматься с ней именно как с человеком - она очень приятная во всех отношениях.	Репетиторы по английскому языку		порог 0.8, ранд seed ранд тем от 0.1 до 0.4069	AI	0.0
Занятия с преподавателем английского языка были очень результативны. У меня повысился уровень знаний, я стала лучше понимать английский язык и разговаривать на нем! Репетитор умеет найти подход к ученику  в доступной форме объясняет материал так что все хорошо усваивается!	Репетиторы по английскому языку		порог 0.8, ранд seed ранд тем от 0.1 до 0.3395	AI	0.0
Занятия с преподавателем английского языка продолжаются, она нравится мне лично. Репетитор помогает мне повысить уровень владения английским языком до более продвинутого уровня (на данный момент мы уже перешли на третий курс ВУЗа). Это пунктуальный человек! Она всегда приходит вовремя к занятиям по английскому языку.	Репетиторы по английскому языку		порог 0.8, ранд seed ранд тем от 0.1 до 0.830	AI	0.0
