review	sectionId	type_page	type_model	type_review	used
Данный специалист как преподаватель мне понравился тем, что он умеет наладить контакт со своим учеником. Репетитор хорошо владеет английским языком и грамотно излагает материал по предмету! С сыном у них сразу сложились хорошие отношения друг с другом - они быстро нашли общий язык . Занятия всегда проходили в комфортной рабочей атмосфере без какого-либо дискомфорта для ученика или преподавателя! Благодаря занятиям мальчик стал лучше знать английский, его уровень знаний значительно повысился!!!	Репетиторы по английскому языку		порог 0.8, ранд seed ранд тем от 0.1 до 0.2660	AI	0.0
Учитель быстро нашла контакт со старшим сыном, они отлично поладили между собой. Репетитор помогает сыну повысить уровень знаний по английскому языку и занятия проходят продуктивно! Педагог использует в работе различные учебные пособия на занятиях с учеником - это аудирование , просмотр видеоматериалов. В целом мы довольны работой преподавателя!	Репетиторы по английскому языку		порог 0.8, ранд seed ранд тем от 0.1 до 0.1186	AI	0.0
Учительница нас полностью устраивает как с профессиональной, так и личностной точки зрения! Репетитор помогает нам повысить уровень владения английским языком на начальном этапе обучения. Педагог хорошо владеет своим предметом  - у нее хорошее произношение английского языка (что очень важно для работы), она доступно излагает материал ученику начальной школы при помощи игровых методик преподавания в игровой форме; занятия проходят интересно ребенку 4-го класса со средним уровнем знаний предмета. Занятия всегда начинаются вовремя! Все договоренности строго соблюдаются педагогом, одним словом мы довольны сотрудничеством!!!	Репетиторы по английскому языку		порог 0.8, ранд seed ранд тем от 0.1 до 0.1902	AI	0.0
Педагог очень хорошо помогает мне в изучении английского языка. Она использует много учебников, аудио- и видеоматериалов на занятиях с ней проходят интересно! У меня уже есть успехи от занятий - я стала понимать английскую речь лучше по грамматике предмета, мой словарный запас увеличился за это время более чем вдвое; также благодаря преподавателю мои знания разговорного уровня стали намного выше!	Репетиторы по английскому языку		порог 0.8, ранд seed ранд тем от 0.1 до 0.2448	AI	0.0
Педагог мне очень понравилась, и я с удовольствием продолжаю обучение. Репетитор хорошо преподает английский язык по своей программе в соответствии со школьной программой за 5 класс (у нас углубленное изучение языка). Уроки проходят интересно для меня - мы слушаем аудиозаписи на английском языке или читаем книги из библиотеки репетитора. Я уже чувствую прогресс!	Репетиторы по английскому языку		порог 0.8, ранд seed ранд тем от 0.1 до 0.468	AI	0.0
Педагог дает отличные знания по английскому языку. У меня были определенные цели в изучении языка и я хотела их достичь с помощью репетитора - она помогла мне это сделать! Я очень довольна ее работой!!!	Репетиторы по английскому языку		порог 0.8, ранд seed ранд тем от 0.1 до 0.1735	AI	0.0
Замечательный репетитор, нам очень понравилась. Она нашла подход к ребенку и занятия проходят интересно! Педагог помогает моему сыну подтянуть успеваемость по английскому языку в школе (3 класс) за 2 месяца занятий с преподавателем мы уже увидели хорошие результаты - оценки у сына улучшились на балл!!	Репетиторы по английскому языку		порог 0.8, ранд seed ранд тем от 0.1 до 0.1742	AI	0.0
Замечательный репетитор! Она очень хорошо и доступно объясняет материал, всегда готова ответить на вопросы. Занятия проходят в комфортной обстановке с использованием различных материалов (видео-, аудиоматериалы). Я уже значительно лучше стала понимать английский язык по предмету благодаря занятиям именно с данным специалистом.	Репетиторы по английскому языку		порог 0.8, ранд seed ранд тем от 0.1 до 0.2509	AI	0.0
Учительница дает мне уроки английского языка. Она очень пунктуальна, ответственна и всегда готова к занятиям! Я уже значительно лучше стала знать грамматику по предмету благодаря репетитору - это заметно даже на школьных уроках.	Репетиторы по английскому языку		порог 0.8, ранд seed ранд тем от 0.1 до 0.2464	AI	0.0
Очень хорошая учительница, я даже не ожидала такого хорошего результата. У меня были большие пробелы в знаниях английского языка и за короткий срок мы их полностью ликвидировали! Я считаю её одним из лучших преподавателей по английскому языку среди тех кто у нас был до нее!!!	Репетиторы по английскому языку		порог 0.8, ранд seed ранд тем от 0.1 до 0.3667	AI	0.0
"Педагог очень хорошо, качественно подготовила меня к сдаче экзамена в университете. Я сдала его на ""отлично"". Преподаватель мне помогла подготовиться и дала хорошие знания по грамматике английского языка!"	Репетиторы по английскому языку		порог 0.8, ранд seed ранд тем от 0.1 до 0.3032	AI	0.0
Прекрасный педагог, она очень нравится ребенку. У нас были пробелы в знаниях по английскому языку и репетитор помогает их восполнять с помощью дополнительных материалов на компьютере или ноутбуке - все это интересно для ребенка!	Репетиторы по английскому языку		порог 0.8, ранд seed ранд тем от 0.1 до 0.2925	AI	0.0
Прекрасный преподаватель, у нас очень хороший отзыв. Она умеет найти подход к ученику и заинтересовать занятиями! Уроки проходят интересно в игровой форме с использованием различных материалов на уроках английского языка (картинки животных, картинки из журналов). Мы занимаемся всего месяц но уже видим результат от занятий - уровень знаний по предмету стал выше. Спасибо большое педагогу за ее работу!	Репетиторы по английскому языку		порог 0.8, ранд seed ранд тем от 0.1 до 0.1930	AI	0.0
Преподаватель нам очень нравится, мы планируем продолжить с ней заниматься до конца учебного года. Педагог хорошо преподает английский язык и занятия проходят интересно для ребенка! Репетитор помогает ребенку повысить уровень знаний по предмету в целом (грамматика), а также дает знания на разговорную часть языка - это необходимо сыну при поездке за границу или общении со сверстниками-иностранцами . Уроки всегда начинаются вовремя, обстановка комфортная без каких либо отвлекающих моментов!	Репетиторы по английскому языку		порог 0.8, ранд seed ранд тем от 0.1 до 0.3713	AI	0.0
Замечательный педагог. Он очень хорошо и доступно объясняет материал, всегда подготовлен к занятиям в соответствии с нашими пожеланиями по поводу того или иного материала (грамматика английского языка). Уроки проходят интересно для меня! Я уже значительно лучше стала знать английский язык благодаря репетитору.	Репетиторы по английскому языку		порог 0.8, ранд seed ранд тем от 0.1 до 0.2514	AI	0.0
Педагог очень помогла моему сыну в изучении английского языка. Она хорошо и доступно объясняет материал, занятия проходят интересно для ребенка (он учится во 2 классе). Результаты есть! У сына улучшилась успеваемость по предмету - он стал получать хорошие оценки на уроках. Мы довольны подбором специалиста!	Репетиторы по английскому языку		порог 0.8, ранд seed ранд тем от 0.1 до 0.393	AI	0.0
Педагог нам очень нравится, она грамотный и профессиональный преподаватель. Репетитор помогает мне повысить уровень владения английского языка с нуля до более продвинутого уровня (бизнес-английский), использует в работе различные аудио-, видеоматериалы на занятиях для лучшего запоминания материала по предмету! Мы занимаемся всего месяц , но уже виден хороший результат от занятий - мой словарный запас увеличился за это время раза так во два. Я всем довольна!	Репетиторы по английскому языку		порог 0.8, ранд seed ранд тем от 0.1 до 0.1480	AI	0.0
"Преподаватель занимается с моей дочерью английским языком. Она очень пунктуальна, ответственна и всегда готова к занятиям! Педагог помогает ребенку повысить уровень знаний по предмету в целом - это нам уже помогло при поступлении ребенка на бюджетную основу обучения во ВГИКе (специальность ""режиссер телевидения"")."	Репетиторы по английскому языку		порог 0.8, ранд seed ранд тем от 0.1 до 0.3752	AI	0.0
Учительница мне очень нравится! Она хорошо преподает английский язык, доступно и понятно объясняет материал. Репетитор помогает моему сыну повысить уровень знаний по предмету в целом - это нам необходимо для поступления на бюджетное отделение ВУЗа (МГИМО). Мы довольны сотрудничеством с педагогом  до сих пор!	Репетиторы по английскому языку		порог 0.8, ранд seed ранд тем от 0.1 до 0.2967	AI	0.0
Учительница очень нравится моей дочке. Она хорошо ладит с ребенком, занятия проходят интересно и продуктивно для ребенка 4 класса по английскому языку в школе №117 города Москвы. Репетитор помогает ребенку повысить уровень знаний английского языка на данном этапе обучения - это уже большой прогресс!	Репетиторы по английскому языку		порог 0.8, ранд seed ранд тем от 0.1 до 0.812	AI	0.0
Очень хороший репетитор! Она хорошо преподает английский язык. Педагог доступно объясняет материал, и занятия проходят интересно для ребенка 4 класса с удовольствием. Репетитора мы рекомендуем другим клиентам сайта!	Репетиторы по английскому языку		порог 0.8, ранд seed ранд тем от 0.1 до 0.1476	AI	0.0
Отличный преподаватель. Она очень хорошо объясняет, всегда готова к урокам и занятиям! Я не ожидала такого результата от занятий с ней - за короткий срок я стала понимать английский язык на слух намного лучше (говорю почти свободно).	Репетиторы по английскому языку		порог 0.8, ранд seed ранд тем от 0.1 до 0.2569	AI	0.0
Учитель очень быстро нашла общий язык с ребенком. У нас были определенные требования, и репетитор их выполнила в полной мере! Она хорошо подтянула ребенка по английскому языку - у него уровень Pre-Intermediate стал выше среднего (я просила именно этого). Мы остались довольны работой педагога на все 100%.	Репетиторы по английскому языку		порог 0.8, ранд seed ранд тем от 0.1 до 0.2832	AI	0.0
Педагог очень внимательная, добрая и отзывчивая. Она сразу поняла мои цели в изучении английского языка (я изучаю бизнес-английский), подобрала программу обучения исходя из моих знаний по предмету! Мы занимаемся с ней дистанционно 2 раза неделю на протяжении двух месяцев - результат меня полностью устраивает!!!	Репетиторы по английскому языку		порог 0.8, ранд seed ранд тем от 0.1 до 0.4051	AI	0.0
Очень внимательный и терпеливый преподаватель, быстро нашла подход к ребенку. Уроки проходят в игровой форме с использованием различных материалов на английском языке (картинки животных), ребенок занимается охотно! Результаты есть - у ребенка улучшилась успеваемость по предмету во 2-м классе!!	Репетиторы по английскому языку		порог 0.8, ранд seed ранд тем от 0.1 до 0.2780	AI	0.0
Педагог дает отличные знания по английскому языку моей дочери 9 лет. Она очень хорошо ладит с ребенком, умеет заинтересовать занятиями и доступно объяснить материал ученице начальной школы (3 класс). Занятия проходят в игровой форме на английском языке для поддержания интереса к изучению предмета у ребенка!	Репетиторы по английскому языку		порог 0.8, ранд seed ранд тем от 0.1 до 0.111	AI	0.0
Педагог занимается с моим ребенком английским языком. Она очень хороший преподаватель, грамотный и компетентный в своей области специалист! Репетитор помогает моему сыну повысить уровень знаний по предмету до более высокого уровня благодаря регулярным занятиям английского языка (2 раза месяц). Педагог дает много материала на занятиях для лучшего усвоения информации учеником во время занятий - все четко структурировано согласно плану обучения моего сына. Занятия проходят интересно, продуктивно! Мы довольны сотрудничеством со специалистом : ребенок получает достойные знания от репетитора за короткий срок сотрудничества между нами!!	Репетиторы по английскому языку		порог 0.8, ранд seed ранд тем от 0.1 до 0.1777	AI	0.0
Преподаватель мне очень нравится, мы с ней продолжаем заниматься до сих пор! Педагог помогает мне освоить английский язык и занятия проходят в комфортной рабочей атмосфере. Репетитор дает за урок большой объем информации - я получаю достойные знания по грамматике языка  благодаря этому специалисту у меня есть прогресс во всех направлениях моей работы над английским языком : улучшилась разговорная речь, расширился словарный запас. Мне все понятно на занятиях репетитора (в том числе объяснения сложных тем), материал хорошо усваивается без проблем!	Репетиторы по английскому языку		порог 0.8, ранд seed ранд тем от 0.1 до 0.500	AI	0.0
В начале работы репетитор английского языка произвела на меня приятное впечатление. Она очень доброжелательная, пунктуальная и ответственная! Уроки проходили интересно для ребенка 4 класса с углубленным изучением предмета в школе №1 города Москвы. Репетитору удалось заинтересовать моего сына предметом настолько хорошо что он начал заниматься самостоятельно без помощи родителей. Я считаю это большой заслугой педагога!	Репетиторы по английскому языку		порог 0.8, ранд seed ранд тем от 0.1 до 0.168	AI	0.0
В принципе, всё было хорошо. У нас с репетитором по английскому языку был всего один урок в неделю и он мне понравился тем что мы занимались не только разговорным английским языком но ещё грамматикой тоже уделяли время этому предмету так как я учусь на переводчика английского языка. Мне понравилось заниматься именно потому,что педагог очень доступно объясняет материал а также даёт много информации для того чтобы лучше усваивался весь объём материала который требуется от ученика за короткий промежуток времени (около 1 часа).	Репетиторы по английскому языку		порог 0.8, ранд seed ранд тем от 0.1 до 0.3247	AI	0.0
В принципе, мне нравится заниматься с преподавателем. Она очень хорошо объясняет грамматику и дает много разговорной практики для того чтобы я могла свободно общаться за границей на английском языке в поездке или просто при общении дома. На занятиях мы используем аудиозаписи - это помогает лучше усваивать материал по предмету!	Репетиторы по английскому языку		порог 0.8, ранд seed ранд тем от 0.1 до 0.2968	AI	0.0
В принципе, мы довольны работой педагога. У нас были некоторые проблемы с английским языком и репетитор нам помогла их решить за короткий срок - это очень хороший результат! Мы занимались всего месяц или чуть больше по времени работы преподавателя со мной (я уезжал в командировку). Я остался доволен сотрудничеством на все 100%.	Репетиторы по английскому языку		порог 0.8, ранд seed ранд тем от 0.1 до 0.2631	AI	0.0
